279510	how many chromosomes are in the somatic cell
312196	how much does a wwe referee make
689399	what is a logical appeal?
898732	what stds are checked by urine samples
759050	what is inflamed in polymyalgia rheumatica
411841	is harcourt a publisher
425436	is ted kaczynski insane
790690	what is render scale
445598	marketing research what do they do
499374	slipped disc signs and symptoms
238023	how it take to brine pork for grilling
661360	what foods contain lactose
104274	cost of genetic testing
16394	ambush definition
222927	how do you lift credit freeze experian
541359	washington dc to new york distance
213955	how did lake superior form
542080	way is my account locked
500239	solute definition chemistry
474058	pet sitting service cost
1161206	what does manifest mean for cargo booking
939168	when did jamaica gain independence
1141182	where is encampment, wy
180836	entrenched meanders definition
1149256	what is the scientific name for black pepper
351683	how to convert degrees celsius to fahrenheit
130307	definition carpetbaggers
285527	how many horsepower are dragsters
674441	what is a beef brisket flat
671043	what information is included on a personal medical record
987800	where is michelin tires manufactured
530793	typical cost of foundation repair
1176458	average temp in oklahoma
930923	what's symbolic interactionist
139895	definition services delivery model
491317	salary and benefits for a network technician
1058550	who wrote my girl by dylan scott
323223	how much is the government old age security pension in canada
89421	cedar shingle installation how much per square
355647	how to do a poll on twitter
646854	what does reiki mean
609870	what county is mount carmel texas in ?
860997	what is victoria's secret creator
311287	how much does a rn make in a year in alabama
846100	what is the scout law
160180	do you feel better after a blood transfusion
870940	what kind of test would be run for clostridium difficile
888883	what product is good for constipation
603184	what county is bird in hand pa in
475809	plantar fasciitis symptoms and signs
112576	credit hours for bachelor's degree
1057693	who who is mordred
61455	cambridge ny is in what county
751331	what is glossolalia
40883	average price of oil change
195392	glycolysis is considered an ancient metabolic system
809986	what is the capital of usa
292096	how many people die from texting and driving a year
676573	what is a catabolism
410541	is franklin square nassau?
525033	trulicity pen side effects
689043	what is a lime rickey?
1163001	what do elevated tumor markers mean
608661	what county is little italy cleveland oh
958640	when was louis xvi born and died
625410	what do the radial muscles do
77624	can you get a face lift how much does it cost
280356	how many cubs does a black bear have
964918	where are amana washers made
574458	what are the ten largest islands in the world
720992	what is aum finance
838888	what is the percent of overweight american adults
1184936	zoloft side effects while starting
659179	what family members are covered under the family leave act
593087	what causes trapezius muscle spasms
771247	what is mesopotamia now
537253	viral hepatitis c usually transmitted by
184252	extended instruction pointer definition
774859	what is myelopathy symptoms
268350	how long to bake whole salmon in oven
842950	what is the purpose of the truman doctrine
960568	when was the death penalty abolished
1165693	what are the roles of the community to health care services
180860	entry fee for disneyland
1149517	current population of pickens county alabama
359734	how to fix a dryer that won't turn off
1065671	why do starches and sweets make you fat
566396	what are subcutaneous injection sites
276243	how many calories burned per minute playing video games
1034102	who is jasmine johnson
186988	find a fast diet to lose 20 pounds
127053	define shrubs
954172	when puerto rican day parade
844101	what is the renin angiotensin system
556901	what are complementary angle
773264	what is mongolian bbq
963251	when were convection ovens invented
742725	what is edq oracle
151798	direct responsibility definition
631687	what does an ankle mri include
399147	is 39 degrees a high temperature
50551	benefits of cucumber skin
652136	what does the name veronica mean
41494	average rent for one bedroom apartment in nyc
317076	how much does it cost to use an echo after purchase
964835	where and when did aztec civilization develop
837452	what is the oldest cat
800913	what is sulfasalazine used to treat
313614	how much does dental bonding cost
142392	determining the molar concentration of a sodium hydroxide solution
337081	how old should a indoor kitten be to vaccinate
728010	what is carnosine
1006658	which cell type is most abundant in the retina
660105	what font is the clearest to read
775114	what is naloxone hcl
267544	how long should you let fish soak for ceviche
711470	what is an allegation
924635	what will be salary of sbi clerk
19001	another way to say keep in mind
314241	how much does is cost to rent a dumpster
98279	convert cmyk to rgb online
493766	scientific theory meaning
183158	exclamation definition
702853	what is a tariff utility
66337	can dementia be prevented
369113	how to make injera
651966	what does the name roy mean
514844	the confederate flag meaning
1042734	who is vladimir lenin
1141640	where do the majority of mass shootings take place
1056810	who was the scientist who discovered pangea
588930	what causes inflammation in knee joints
364241	how to help kidney pain
491624	salary for oral surgeon
584788	what causes a person to get so sleepy after eating
16535	american airlines toll free number
1042831	who is who is the creator of microsoft?
748268	what is folic acid?
528875	types of muscle rigidity
756492	what is hydrogen peroxide
939696	when did mattel introduce black barbie
754548	what is hemp castile soap made from
211069	how can the spread of malaria be controlled
1053224	who was alan rickman
551160	what age does child support end nc
1181789	how do baboons adapt
98281	convert cocoa grams to teaspoons
362533	how to get rid of house flies naturally
46592	average vertical jump men
183996	explain what neurons are
798791	what is spirulina
1006234	which boom pole is lightest in weight
1170265	surface tension earth science definition
608144	what county is lafayette ga
607317	what county is holdingford mn located in?
478991	poultry definition of poultry by
269719	how long to cook filet mignon in oven and at what temp?
440458	lipogenesis occurs when ________.
817978	what is the difference between molecules of soaps and detergents
586905	what causes crenation to occur
638719	what does hawkish mean in politics
144307	did kaepernick wear a castro shirt
703279	what is a thematic phrase
728403	what is cause of corners of mouth to be sore
503560	step brother in spansih
618087	what destroys platelets
1184069	dr lauren shapiro licence number
147007	difference between delete and drop in sql
358682	how to find longitude and latitude on google maps
496724	should people with mental illnesses be in a relationship
1018698	which river did lewis take when he split up with clark
1059205	who wrote the song hollywood
697349	what is a rash
126377	define rejoin
164784	does coconut milk go bad
669221	what holidays did cherokee celebrate
38135	average labor cost percentage of operational cost
290809	how many oscars has martin scorsese won?'''''''''''''''''''''''''''''''''''''''''''''''''''''''
176318	dsst exam cost
999918	where is weather nation based
603235	what county is bloomfield, nj
719491	what is arcnet
317426	how much does mariska hargitay make per episode on svu
471485	panera iced tea calories
836037	what is the navy tune that is played at evening colors
353578	how to create if error formula
202593	highest paid victoria's secret model
618273	what determines the direction of heat flow?
42092	average salary for actress
960158	when was the 9th amendment proposed and ratified
863953	what is xii
150771	different types of plants names
106503	cost of redoing bathroom
407294	is costco opening new stores
27723	asu mascot meaning
1051500	who sings only in my dreams
565184	what are some assessments for depression
1161021	causes of nerve problems in dogs
181947	ethnic population in italy
620762	what dimensions of index card
961471	when was the hurricane on kauai
1138662	who is e michael jones
882187	what number is navy blue
399135	is 3300kWh average electricity consumption
179873	embargo act definition
955415	when to fertilize hyacinths
416248	is lesa a girl name or boy name
32670	average cost of a child in one year
495252	severe anemia causes
506110	symbolic meaning of circle
613240	what county is sterling heights  mi in
180359	ending a fixed term tenancy
432735	jamestown ny is in what county
418477	is montreal in ontario
624738	what do saturated fats do to your body
90879	chase bank payoff number
170693	does prozac cause insomnia
72424	can pin worms or hook worms cause diarrhea
771850	what is microblading e
798587	what is speculoos
86899	causes of hypokinesis
591176	what causes recurrent pleurisy
225116	how does a skin peel cost
1068950	why human are complex organisms form 1
473104	per diem day rate
409767	is exercise in water as good as on land
1043141	who killed selena
941857	when did the lindbergh baby go missing
825258	what is the hottest town in the world?
649766	what does the chile flag mean
1138127	who is the owner of the onion
726108	what is bruckins
408188	is diagenesis chemical
461690	name of federal workers retirement system
41992	average salary for a major league baseball player
815512	what is the definition of specialization
215294	how did the medieval period begin
996530	where is the maitland located
666793	what happens to the volume of a substance when the temperature increases?:
436191	largest city in maverick county
125590	define ppe
83664	cast of who eating gilbert grape
593289	what causes valve regurgitation
240530	how long before hiv is detected in the body
230005	how far can irs go back with your taxes
1002181	where was clark gable born
1029925	who is america's ambassador to japan
495777	shingles on nose symptoms
478343	population of wadena, mn
188531	food is moved through the digestive tract by a special movement called _________
804635	what is the allowable income for kid care fl
753954	what is hcl chemical name
980694	where is crankshaft sensor located
772022	what is microsoft ping
877205	what medical term means before meals?
460452	mumps symptoms causes and treatment
923944	what were the causes of the fear of communism in the u.s.
49755	behind the scenes at the museum meaning of title
311167	how much does a raised foundation cost
396108	inhalable particle size
217802	how do i delete someone from my facebook business page
1036428	who is navia robinson in shows
311297	how much does a rolex covered in diamonds cost?
1162596	what does a facility director do
731325	what is clitoridectomy
125717	define primary productivity
547868	weighted average cost method
653819	what does this mean annuities
454386	minimum design temperatures
311051	how much does a professional basketball player make
974268	where does the fermentation take place in the cell?
504206	strategic importance of arabian sea
299051	how many unesco world heritage site are there
391857	if the core part of the sun increases
125371	define pin one's hopes on
177037	dysfunction psychology definition
685077	what is a good batting average mlb
232981	how fast are jet skis?
586766	what causes constipation in babies and toddlers
197768	gvhd definition
830679	what is the meaning of Aarya
468423	olfactory receptor cells anatomy definition
898717	what std does metronidazole treat
1065473	why do pools smell like chlorine
301957	how much al green net worth worth
259102	how long does opioids stay in system
843812	what is the relationship between accuracy and significant figures?
753122	what is gum made out of today
207993	how audrey hepburn die
661719	what foods help testosterone
1006022	which biome has the greatest species diversity
601463	what could it be when your lower back hurts
228655	how does water ph affect health
625412	what do the refs get paid for the super bowl
198944	has james spader got any family
231233	how far is humble tx from houston tx
203734	history of socratic method
715978	what is an ivd
586943	what causes cushing's disease
682245	what is a dth
822670	what is the function of stomata
83397	cast of holes movie
331192	how nike lost steph curry
416182	is legion marvel
638995	what does hogwash mean
293559	how many points needed to become platinum elite on marriott
928635	what year was the transcontinental railroad open to passengers in colorado
3094	Froyo franchise cost
774940	what is myth
1056639	who was the oldest ever uk monarch to sit on throne
674720	what is a bindle
557015	what are consequential damages
855970	what is ti allowance on a lease
680114	what is a cupola
776509	what is new mexico medical marijuana laws regarding patients rights from dr
1142535	when should audit report be dated
1168497	vikas machinery
56260	brian weber telephone number
816713	what is the difference between a therapist and a psychologist?
982751	where is foley mn
428909	is there an essential oil for ticks?
475701	places to stay at oswego harbor
597052	what college did sandra day o'connor went to?
441367	liters measures what
536908	video of how hurricanes are formed
1071354	why is my cat losing his hair
809410	what is the bodies surrounding europe
907667	what to include in a resume
985154	where is jack kerouac's grave
134896	definition of general operating expenses
493915	scrag definition
225718	how does carbon enter the hydrosphere
1061524	why brass tarnishes
28448	at what age does the fetus have a heartbeat
859840	what is used to measure air temperature
487518	renee meaning and origin
959134	when was nordstrom anniversary sale
516640	the largest cucumber
22843	are hearing aids tax deductible
230672	how far is buffalo to washington dc
1058022	who wrote and sang papa was a rolling stone
1068056	why does the appraiser only one parcel under multiple parcel deed
401024	is a standard score and z score the same thing
268885	how long to charge a tesler
821683	what is the float
689789	what is a magnetic poles
695042	what is a plantain plant
897110	what sport is used for atp
1051628	who sings shake a tail feather
1055920	who was the first black senator
11014	actress who plays dot on miss fisher
3339	Home Remedies for Pet Itching
603706	what county is burien wa in
468461	oltc how often is a load bank test to be done on a generator
486181	record for the longest winning streak to start an NHL season
44969	average temperature february walla walla washington
604523	what county is coloma wisconsin located in
88982	causes of very yellow urine
475404	pimento indiana is what county
1153432	what is pabulum
613586	what county is the city of long lake mn in
107987	cost of weight watchers
27198	as long as you're taking the hormone pill you will not get your period?
681759	what is a document open
610778	what county is orange, ca
1172521	nys dol how long must you maintain payroll records
249937	how long does a philosophy degree take at oxford
626168	what do you call a polygon with 100 sides
741094	what is dowfrost hd used for
839184	what is the phone number for cvs c
1010133	which geranium oil is good for skin
554980	what are antibodies in blood plasma
640009	what does it cost for long term parking at jacksonville airport
837921	what is the origin of juneteenth
817912	what is the difference between md and a do
198900	has cyndi lauper had cosmetic surgery
708193	what is adfs?
458651	most popular flower essences
1142131	when was thomas gold died
706409	what is a wolf hybrid
667427	what happens when the thermal energy of a substance increases
643021	what does mazor robotics, ltd do?
961049	when was the first labor union created
670312	what illness besides cancer can cause severe loss of hair
408346	is direct tv a satellite dish
667570	what happens when you drain a swamp
11730	admissions against interest definition
971887	where do tigers live
237764	how is the weather in alaska in june
335383	how old is john goodman?
341682	how tall should the shower valve be
834580	what is the name of dca airport?
369611	how to make rump roast in oven
248850	how long does a bankruptcy stay
957944	when was harry potter built at universal
836912	what is the normal temp on a baby
257786	how long does it take to pan fry pork chops
645553	what does phosphorus do to help plants
550747	what age do girls stop growing
560266	what are implants for teeth
412214	is hexylene glycol hygroscopic
631729	what does an assistant project manager do
666034	what happens if you delete add on like java
479473	preempt definition gre
7653	What is the origin of the name Obie
137147	definition of plaguarism
1023723	who are apple's competitors
490823	russian bear vodka alcohol percentage
692576	what is a noise impulse meter
964591	when you have cramps on the day for your periods
1069300	why is acrylic used
654645	what does valente mean
256421	how long does it take to fly to omaha from denver
114983	d-wars dawdler
740684	what is dodge county's tax rate
451601	medicare wps claims phone number
722402	what is barrett's disease
517632	the most important mineralocorticoid regulator of electrolyte concentrations in extracellular fluids is
922828	what was the time period of the renaissance
207470	how are hazards identified during mission
209087	how big is earth
109865	cost to install interior door
445204	manyara name meaning
852439	what is the upper continent called
119749	define cross vesting scheme
622410	what do catalpa worms come from
83550	cast of stitchers tv show
634224	what does certo contain
700627	what is a soffit
642436	what does lipase test reveal
517948	the number of people a given manager directly supervises is called the __________ .
834031	what is the most valuable yugioh card
971556	where do snapping turtles live
742660	what is eczema causes
694923	what is a pinot noir
666339	what happens in coronary artery disease?
682008	what is a dough retarder
364017	how to hatch duck eggs at home
837923	what is the origin of kershner
937631	when did caa become faa
699067	what is a schleprock
764638	what is latvia bank country code
923485	what website to use to buy alhambra tickets
501703	spondylitis definition
437180	largest ranch in oklahoma
1140558	where is the spanish guinea
836339	what is the newest version of clash royale
648717	what does styx mean
216539	how do birds reproduce
885812	what percent of incoming solar energy is absorbed by land and oceans on earth?
293115	how many phenotypes are in a trihybrid cross
178402	effective communication scenarios
338875	how should you dress to go to a beach wedding in barbados
909974	what type extension cord for generator
984566	where is hollywood gateway inn
974354	where does the kiel port go to
1034807	who is katie in heartland
835849	what is the name of who played hermione on harry potter
852895	what is the variance of x
25951	are tricyclic antidepressants found in the body
890152	what radio station for mark levin in sacramento ca
876037	what makes waterproof fabric
815687	what is the definition of undercapitalized
461072	nadolol is used for what
1178835	how many kids are born each day in the us
609511	what county is miller place ny in
932895	what's the rooney rule
824471	what is the heart ventricle
536023	vegetables that are high in protien
1026414	who did halle berry date
300813	how many years does it take to be a graphic designer
252848	how long does it take for a check to process chase
738013	what is deep water wash cycle
672124	what is .net framework utility
768792	what is marvel gaze
454162	minimed distribution phone number
561482	what are marginal frequencies in math
27026	artist born is strasbourg
893807	what should i bench
196558	granite state power link
388925	hoyt carbon defiant ibo speed
525990	type ab blood
309166	how much does a cubic yard of sand weight
581626	what can cognitive therapy treat
135444	definition of indebted
83680	cast on merrily we live movie
901608	what temperature does a chicken brooder need to be
73686	can someone spy on my text messages
102988	cost of building trex deck
829625	what is the main source of energy
553142	what all is located in the midbrain
579495	what body system is kidney
404232	is bibimbap nutritious
942514	when did the vatican become a sovereign state
476885	population bradley il
390459	ibrutinib revenue
283633	how many felony cases actually go to trial
564794	what are side effects of lantus insulin?
1141898	where are the electron transport chain of cellular respiration located
1054741	who was lead singer a women for jefferson airplane
485560	reaction definition
724931	what is bluish tinge 
192586	function to remove spaces between
604612	what county is concord, north carolina in
609015	what county is mammoth lakes
455787	monroe ohio is in what county
879040	what mountain center california
664546	what group made the classic song jumpin jack flash
397435	interrelationship definition
126362	define register
419196	is nexium safe
1156735	what is an onion spring
937604	when did brown v board of education begin and end
602471	what county is apache junction in az
482775	promissory note definition
151354	digital credit union customer service number
571516	what are the means of the tribal tattoo
528482	types of lily bulbs in florida
125433	define platforms
189319	foods that control blood pressure
279362	how many children does jacue pepin have
667381	what happens when the bees die
1055349	who was richard feynman
552421	what airlines use united
309651	how much does a gas heater cost to run
155113	do baby sleep more when teething
767851	what is magnesium used for in the human body
929893	what's a telethon
545205	weather in muscat in november
692041	what is a narrative poem
969627	where did the last earthquake happen
854207	what is the weight to put your child in a booster seat
257372	how long does it take to get your tax return back canada
896610	what sound travels fastest
29079	at what temperature is a roast beef at when it's done
562257	what are nerve cells made up of
627947	what does Office 365 E1 plan mean
226386	how does gps work
968300	where did amelia earhart fly over
126009	define pulse point
175586	dragon age inquisition things to do
503600	stephen honig rheumatologist
1154326	what is kbs clear coat
139017	definition of transfiguration harry potter
371289	how to obtain a ged diploma
12035	advantages of working as an intern at cardlytics
151610	dimming system load schedule
750562	what is genosure archive test
740028	what is disability insurance
1179883	how long is the term for senators
53020	biggest disasters in us history
318739	how much does the schooling for veterinarian cost
766018	what is lingzhi capsule
144955	did romanesque architecture or gothic architecture come first
382212	how to take cosmetology license test
10639	acquia costs
177817	economic fair trade definition
336736	how old is the oldest cow
458168	most important teacher qualities
1150234	what is the message of twelve angry men
323470	how much is tigers net worth
814059	what is the cycle levels of estrogen
710036	what is amazon business prime
780727	what is oversteering in a car
910698	what type of bridge is sydney harbour bridge
612617	what county is shady side md
853080	what is the volume of a frac tank
616321	what date is late summer
421696	is proin safe for dogs
68465	can i buy a home with my ira
810514	what is the center of the ovary called
1018261	which programming language do you prefer?
887249	what plant does niger seed come from
481616	primary secondary and tertiary sectors definition
943944	when do gladiolus come up
632562	what does astute
289957	how many months to make pfc
1043014	who is zacks
680733	what is a degree day?
47950	az gas prices average
306916	how much do pool gates cost
23255	are king oscar sardines wild caught
606226	what county is fresno tx
463313	nerve pain medication
641956	what does kidney pain mean
676152	what is a cami
896471	what song do they dance to in pulp fiction
440088	limit carbs maintain weight
411942	is hcl extended release
1026244	who developed the continuous-scale physical functional performance test?
514511	the biggest atomic bomb explosion
649757	what does the checkered flag mean in racing
1147109	what muscles contract during inhalation
78645	can you make sparklers tags
928566	what year was the radiation invented
291167	how many ounces is a quarter pound
836993	what is the northbridge
393950	in what county is hammonton nj
414986	is jaundice common in infants
1007153	which college teams recruited kevin durant
302548	how much baking powder in muffins
