427935	is there a cap on amount chanrged to a tenant for a late fee
730549	what is cht medical term
1148878	current weather skopje
517691	the most unreactive element are in which family
967640	where can i find a sand dune
253436	how long does it take for an email account to be deleted
437232	largest roofing distributors
11907	advance directive policy define
90643	characteristics of dietary fiber
716097	what is an major event in a story
726892	what is caduet
385574	how to use ravensara oil
493700	scientific definition of muscle fibre
521777	tire number description
1000257	where is winnabow nc
775053	what is nafion
500102	solar cost decline
40593	average price for milk gallon
660745	what food to eat for cellulite
711523	what is an alpha hydrogen
761789	what is ivig
1173485	meaning of united.
980832	where is cumbria
717748	what is analytic syllabus
601380	what could cause mysterious heel pain?
716168	what is an mmk burch
611509	what county is port charlotte in
724631	what is blend program
661173	what foods can rabbits eat
989935	where is oxford ny
590444	what causes overgrowth of yeast on skin
48299	bacterial toxins definition
763845	what is kuzu ingredient
578967	what biomes do polar bears span in minecraft
80985	can you waive constitutional rights
80424	can you use a medicare set aside for?
473581	performance benchmarks definition
993905	where is syracuse?
915596	what types of food contain cholesterol
566352	what are stribild tablets?
259365	how long does pushing last in labor
992843	where is siam located
69916	can i use a visa gift card on amazon
430579	is va disability payments taxable
1031541	who is compass group usa
24517	are prp
297591	how many tablespoon in a gallon
538759	wages for esi contribution
249329	how long does a dyson guarantee last
1035750	who is mark wahlberg married to
442549	longest night and shortest day
901116	what temp should a fridge be at
198352	hands are always cold to the touch
972583	where does bipolar come from
177043	dysfunctionality definition
316792	how much does it cost to retro fit a california home for earthquake
531110	typical weather in frankfurt germany in january
668840	what helps with erectile dysfunction
779027	what is oil cooler assembly
762260	what is jerusalem artichoke
728444	what is causing all this rain and flooding
606002	what county is forked river nj
1162941	affiliate company meaning
229586	how far apart do contractions start out
75311	can vertigo be caused by stress
105755	cost of new fence
475585	pitch perfect 2 dvd release date
141864	describe the structure of a capillary network
61337	calories strongbow cider
1081366	yelp phone number
504336	stress effects to your skin
834531	what is the name of are spiral arm
266559	how long should apple watch battery last
202819	highest population states who voted for trump
146002	diet to help raise hdl levels
417612	is meal plan included in room and board ucf
63457	can a uti make your dizzy
553146	what all is topamax used for
138711	definition of tertiary
333648	how old do you have to be to rent a car
644991	what does override means
509794	synonym of avenue
890712	what region is jamaica in
385148	how to use duet display
240692	how long before refinancing mortgage
401646	is aetna a medicare plan
480214	price for brake job vw tiguan
1024153	who are the four father
1182965	garmin founders
631309	what does akron mean
331871	how often does esquire magazine come out
633506	what does bravecto treat
546371	weather in vienna late september
102865	cost of brake fluid change
278977	how many ce hours dental assistant
417822	is menadione bad for dogs
1070898	why is it important to know your strengths and weaknesses
453653	middle eastern countries list dna
1141845	where can the atlantic oyster drill be found
435317	lacy rash causes
926299	what year did helen reddy sing you and me against the world
788538	what is pv symptoms
347569	how to calibrate a baker's dough scale
878181	what milligram are my adipex
294173	how many quarters do you need to work to collect social security
969034	where did myles standish help to establish a colony
1184471	dine meaning
1069168	why is a hemoglobin test performed
1016629	which organelle stores energy from biological membranes
299900	how many weeks month
837092	what is the number of calories to eat for weight loss
697018	what is a quarter horse
734528	what is contractionary policy?
663445	what geneva
1156547	what is atipamezole used for
402760	is anaemia hereditary
542017	wavelength symbol
389131	hsn net worth
273825	how long will unopened yogurt last
846408	what is the shape of an octopus
435870	largest automotive supplier
698518	what is a rotator cup
1175202	az statute of limitations on defamation
1172798	nationality is sofia
1002147	where was chayanne born
1041367	who is the person who created the classification system we use today?
476597	political uses of the tropical rainforest
178151	edyn name meaning
982473	where is fairhaven mass
1173138	morphine sulfate adverse effects
426708	is the librarians tv show cancelled
857561	what is triazolam generic for
953850	when is world egg day?
800666	what is substance p
267077	how long should it take for swelling to go down after a fall
910465	what type of beer is sol
13863	age of robbie benson
265047	how long is the legal size of page
707896	what is acute
331685	how often do you change water in aquarium
116227	decerebrate posturing definition
1171335	quicklime price per ton
485592	reading eggs contact number
886011	what percentage do you need to pass the nclex
71687	can napping help your mood
264431	how long is refrigerated unopened sour cream good
461480	name meaning of rylan
874253	what liquors are made of sugar cane
635677	what does decroissant mean
1034461	who is john of monty python?
749533	what is functional service provider
770874	what is melatonin
190525	foods you need to grow healthy hair
51775	best foods to eat for prediabetes
1172522	nys definition of assault
752329	what is gpo
494720	sembach germany army base
232097	how far is raleigh to chapel hill
392435	ihg phone number customer service
631853	what does an endocrinologist do
1143297	when did edgar rice burroughs die
85507	causes of black discharge from dogs ears
534977	uss gerald ford cost
1081481	yosemite clouds rest hike
587817	what causes fatigue and diarrhea
570498	what are the home interest rates in spain
793460	what is sampling distribution of a statistic
634725	what does cody johnson sing
430984	is vitamin e a carrier oil
852472	what is the uruguay xxi
980207	where is clute texas located
595463	what chlorophyll means
216883	how do dolphins swim
334343	how old is auli'i cravahlo
478241	population of stanton ky
390999	identical elements theory definition
987813	where is michoacan mexico located
981492	where is doha airport
714424	what is an exclusive right type listing
357873	how to figure out perimeter
635578	what does dat stand for mcafee
529142	types of particles and bonding in ionic compounds
230366	how far inland can tsunami travel
1031887	who is danielle laporte
934303	what's your zodiac sign date of birth
338840	how should it cost to replace my iphone screen
108653	cost sharing definition
678121	what is a collective farm?
989917	where is owensboro
444882	male seminal vesicles what they do and what they are
940690	when did seat belts come in cars ??
46568	average variable cost definition economics
442798	longest suspension bridge usa
255045	how long does it take mockingbirds to leave nest
285391	how many hands tall was seabiscuit
512255	temperature in niagara falls
1029836	who is alexis sanchez
985921	where is knoxville md
200560	hebrew word for immanuel
395886	influential definition
869870	what kind of panthers live in florida
264881	how long is the flight from sf to jfk ny
716816	what is an oread
514606	the bvi beacon newspaper
511930	temperature guidelines for chicken
671059	what information is obtained through tympanometry?
270398	how long to develop a flu vaccine
224475	how do you use kindle unlimited
127136	define ski jump
858635	what is uber assist
797237	what is sms message
963652	when will cook county taxes be mailed out
1152504	what is stl timezone
1145097	what type of education did henry ford do
183538	explain band width
11716	admiral meaning synonyms
41349	average range room temperature in celsius
13976	age perfect age perfect eye renewal
1151103	what is the driving distance between bloomington, in and columbus, in
390392	ian read pfizer net worth
550262	what age can i draw ss
582394	what can teacher put in sensory table for toddlers
477185	population kansas city
989614	where is ocho rios
401755	is aisha tyler married
754173	what is health problem related to miralax
892447	what school district is hamlin ks in
232331	how far is stockton from sf
671488	what insurance do I need for my shop
763629	what is kof index
948639	when does walking dead series start back
427658	is the university of connecticut
505307	sundry definition
857999	what is trustwave pci
535955	vectorial transport definition
418933	is nasa an independent agency
884766	what part of massachusetts is norwell?
736356	what is csis
438350	leading tone definition
16367	ambiguous language definition
260886	how long for ceftin to leave system
883501	what organism is the source of hiv
361416	how to get data from unallocated partition
660700	what food should a pre diabetic avoid
787735	what is provenge
716194	what is an mpn
841910	what is the purpose of a coelom?
285441	how many hectares in an acre
1077565	will irs accept scanned signatures
160976	do you need to deadhead geraniums
561468	what are manufactured goods
203664	history of eiffel tower paris
25310	are thailand laos cambodia safe
802791	what is technology diffusion
485721	reasonable price for homes in fort bend mission bend
505997	swollen ear canal symptoms
1054794	who was louis xvi
46617	average volume of a human in cm3
542933	weather for super bowl
255402	how long does it take to be a dental hygiene
322730	how much is one tonne
449906	meaning of the name kyla
592018	what causes staph infection in nose
1178992	how many football games has alabama won
265741	how long keep self assessment records
455783	monozukuri definition
93748	cmsp benefits
1082176	zuza name meaning
46631	average wage afl
425385	is tea tree oil good for arthritis
67643	can geologists predict earthquakes
681198	what is a didlo
757740	what is important in housekeeping
713841	what is an epithet examples
962444	when was the tower of london built?
715049	what is an impeller on a boat
119509	define contumacy
1052515	who starred in war of the worlds
523009	total soccer equipment cost
860115	what is vaers
78866	can you paint the basin
648337	what does spi firewall protection provide
426985	is the ocean an open or closed system
707408	what is acculturation?
642699	what does lungs do
417906	is mesalamine used to treat crohn
203184	highest wpm typing
1164315	what color will iodine solution turn if starch is present
227761	how does temperature affect osmosis
30539	average age of american population
826196	what is the interest rate on federal student loans
296147	how many species of wombats are
1172670	nomiss option sas proc means
1011036	which is a characteristic of a homogeneous mixture that is a liquid
388258	how wide do i frame my fireplace hearth
255582	how long does it take to become a paramedic
491947	salary of an lpn in florida
533490	us bank lease payoff dealer phone number
164147	does caffeine help burn belly fat
698358	what is a robber baron
511436	teletubbies here come the teletubbies
424417	is spironolactone potassium sparing
997302	where is the pyramids of giza
291598	how many paracetamol is an overdose
927157	what year did the us mint stop making solid silver coins
54282	black watery diarrhea means what
1004115	where was the wheel invented?
824397	what is the head of the kick drum?
129757	define: slovenly
1027540	who else was shot with bobby kennedy
204117	holdrege ne is in what county
135433	definition of incivility
544751	weather in lake city fl
694865	what is a pilot club
731266	what is clinda-guard for cats
330012	how much was raised in the 2016 invisible primaries
115256	dance notation definition
8722	_____ is turning the palm upward.
784846	what is pocket fund ?
640293	what does it mean if a bird is banded?
814450	what is the define ferocious
1077450	will eu requirements visa for us citizens
540792	was the actress who played carol pregnant
229421	how expensive is food at disneyland
990579	where is pine grove road
190665	forbes list of jewish billionaires
671590	what international airport is closest to red deer alberta
1063180	why did stalin create the 5 year plan
845288	what is the salary for prevention specialist
206880	how about syracuse university?
349038	how to change the language on netflix laptop
335156	how old is idina menzel
828265	what is the life expectancy of a labrador
769440	what is mdi medication
313784	how much does executive coaching cost
1161020	what does oid stand for in accounting
1032916	who is founder of microsoft
46845	average warehouse inventory salary
538967	walking dead season 6 premiere date
168877	does medicare a pay for cataract surgery
36940	average healthy weight loss
752478	what is granite made of
9697	aba therapy defined
756284	what is hunchback
582297	what can protein make
679338	what is a corn meal gluten product
603989	what county is carthage nc in
994646	where is the best place to sell gold
537723	vitamin b12 stored in liver
828042	what is the legend behind a dragonfly
835020	what is the name of the cycle of the female reproductive system
438825	legal definition of defend
606376	what county is garrison, new york in
252542	how long does it take before a bankruptcy is off your credit report
853733	what is the weather in shanghai in december
36196	average earnings of college graduate
509040	symptoms of viral menin
499254	slaughterhouse meaning
1153822	what is mri and
993324	where is sparta tn
429265	is there sales tax on groceries in tennessee
961392	when was the great northern railroad completed?
462416	nasw social work salary study
953250	when is the nintendo classic coming back out
426094	is the dash diet safe for diabetics
732355	what is combination in textile
955270	when to capitalize the word government
403912	is barley malt contain gluten
821230	what is the female reproductive organ that produces egg cells
1019260	which side of the heart is the swan ganz catheter threaded
1078085	william marston invented what
751508	what is glyceryl laurate
704132	what is a trapunto
247636	how long do you cook crab legs on the grill
898139	what state of mexico is puerto penasco
168680	does marijuana affect sperm count
75670	can whiplash cause pinched nerve
867363	what kind of disease can a eye doctor find on a exam
457604	most expensive artwork in the world
633794	what does calcified granuloma in the spleen mean
765427	what is levaquin prescribed for
465341	normal dosage of diazepam
1146942	what organ systems contain the veins
1079316	words that describe precious metals
192596	functional classification of joints is based on
293327	how many players are in a cricket team
976290	where is abaco located in the bahamas
1016542	which organ system is composed of the trachea, larynx pharynx and lungs
1058576	who wrote once is not enough
1157665	what is a reservoir host
927880	what year was iraq founded
1159936	what does twms stand for
7404	What is the average cost per sqft to build a home in Williamson Co tn
53046	biggest economies ppp
684397	what is a gastroenterology
95940	communication is the prime responsibility of a
145000	did sacajawea cross the pacific ocean with lewis and clark
918977	what was one provision of the dawes act
1005306	which animal's milk is chevre cheese
183347	exilis cost
29354	atopy definition
509671	synonym for ripping
541747	water main flushing notice
607345	what county is hollywood fl
486720	regina meaning of name
188307	fmla regulations greater rights and benefits
735835	what is creme fresh made of
90254	chamberlain price nursing
627843	what does Gnostic mean
945341	when do you plant hollyhock seeds
21683	are cigarette ads illegal
726748	what is c++ refrence
393332	in computing what does common match mean
106683	cost of replacing an employee
660998	what foods are high in b12
137882	definition of right sided heart failure
50817	benefits of graham diet
894149	what should you drink after a hard workout
729576	what is chaos syndrome
1033357	who is gru in despicable me
1157001	what is an advance directive in a living will?
209948	how can a fire occur
960714	when was the executive branch created
580842	what can be learn in bartending school
593227	what causes urticarial patch
276438	how many calories does a bowl of cereal have
167223	does honey contain antioxidants
810921	what is the chemical which binds specifically to plasma membrane receptors
113295	cssd dietitian
653870	what does thyroid do to the stomach
973021	where does filtration occur in the kidneys
446165	mauritius average temperature
773904	what is mpo for cardiovascular disease
513619	texas bbva compass routing number
298118	how many time zones are there in china?
539478	warren gangsta harding
968537	where did cucumbers originate
874774	what make alarm does adt use
1176597	how much warning does landlord need to give renter
801543	what is swollen
969913	where did the term big wig originate
58022	caelan name meaning strong
1149619	what is the process of mmr vaccine
1161309	what does knickknacks mean
1069692	why is carbon fibre strong
1166482	what are pandesal
1053425	who was blackbeard
19991	apparatus define
1081195	yarrangobilly limestone caves describe
1050316	who sang these arms of mine
570087	what are the four systems or spheres of the environment?
778234	what is nubuck leather
416229	is lenovo ideapad a laptop
705923	what is a warratah
980674	where is cozumel
1139905	which is incorrect about enzymes?
809461	what is the bolivia flag known for
423422	is selling pets on the internet legal
193101	game inventor salary
802135	what is taltz medication for
81765	candida albicans symptoms in men
49195	battery price for prius
782226	what is pcpi
640401	what does it mean if variance is zero
1067050	why does hot water stink?
1032035	who is degrey
923652	what were cannon units called in civil war
780488	what is osteoporosis and what system does it affect
864997	what is zombie?
1139584	definition of confute
667774	what happens when you stop paying on a life insurance policy
968866	where did john cheever learn to write
887973	what postcode is w1
437272	largest sd card for nintendo switch
544666	weather in kawagoe japan
879854	what muscles are used in sprinting
751053	what is ginny's wand
561716	what are metaphysical items
315865	how much does it cost to hire a lawyer for an eviction
819932	what is the efficiency of a fuel cell
958314	when was jiu jitsu created
882451	what nutrients do vegetables provide
491953	salary of an orthodontic dental assistant
100187	cortisol or testosterone are examples of this type of hormone
112465	creatinine mmol normal range
334810	how old is dennis quaid
434109	kendra meaning of name
671830	what is  awareness month of awareness months month?
359628	how to find your full bank account number
429922	is treasury an executive agency
306524	how much do nurse anesthetist make
885232	what part of the new deal was unconstitutional
989962	where is ozark filmed?
392769	immigration what is ice
568605	what are the cures for the bubonic plague
943936	when do girls start puberty
561188	what are literacy skills
965449	where are grape solar panels made
38212	average length of a pickup truck
575336	what are the types of muscle fibre
1022690	which vitamin deficiency leads to hemolytic anemia? vitamin k vitamin a vitamin e vitamin d
274608	how many american airline miles for a flight
202474	highest paid female singer
968470	where did chicken originated from
56561	bronchitis how long before it goes away
685124	what is a good cpi rate
662551	what four climate zones are found in africa
693327	what is a oligosaccharide
615728	what currency does dominican republic use?
262754	how long is a pre approval good for
1163522	cask temperature
875205	what makes a wheel bearing go bad
657817	what equipment do they use in hockey
1006690	which cells form the stomata? a. sieve cells b. guard cells c. phloem cells d. mesophyll cells
201049	hemoglobin test normal range
729769	what is chelating effect
746871	what is fennel seed
422699	is rockwood a rural municipality
434780	koalas sleep
927752	what year was fall out boy a band
17021	amniotic stem cells definition
258405	how long does it take vigra to work
815444	what is the definition of saturated fat
558092	what are economic systems used for
1019171	which side hook up first battery positive or negative
12300	affect is irritable
947626	when does snook season open in florida
1031879	who is daniel read
595953	what city is halfway between eliot me and springfield ma
1158197	what is a internet meme
52738	biding time definition
614233	what county is walnut cove nc in
87033	causes of intestinal inflammation
1185277	definition of tactful personality
614222	what county is wall, sd in
16634	american express cards start with what number
273788	how long will soup keep in the fridge
104264	cost of gastric bypass surgery
1075753	why was the lipizzan breed
470155	original meaning of fascism
647424	what does sample statistic mean
150681	different types of monkeys and apes
134790	definition of foundation brakes
334703	how old is colin montgomerie
1185363	amlodipine benazepril side effects urination
259479	how long does sausage last in refrigerator once opened
65067	can boot cast
594351	what chain does crowne plaza belong to
898902	what stone evolves lampent
1139660	which part of a flower contains the ovary?
732907	what is concentration meditation?
69018	can i get a writ removed from credit report
189472	foods that help endometriosis
729020	what is celsius to fahrenheit formula
1031950	who is david byrne married to
993114	where is soft shell clam found in mass
405632	is castor oil good for swollen gums
483330	protrusion meaning
583834	what cause intrinsic stain
956712	when was annie the movie made
994036	where is tanzania?
895517	what size is the franklin covey classic
283941	how many furlongs is the grand national
147742	difference between latitude and long
34403	average cost of reupholstering chairs
925046	what work  knee pads stay in place when standing
579320	what boat is royal family suite on
599222	what comes on the amazon fire stick
327318	how much should a refrigerator cost to run every year
1035201	who is leaving on gh
410941	is gelatin good for joints
700257	what is a skort
580742	what can antibiotics do
455352	modernity definition
18689	another name for a porcupine
284921	how many grams of fat in grilled chicken
205087	honda unicorn price in mumbai
73688	can someone survive coma after botulism
1003171	where was pom klementieff born?abcddeefghijklmnooabcdd
270643	how long to get a bachelors after an associates
134152	definition of duress
135202	definition of hieroglyph
728287	what is catecholamines ?
234872	how good should your credit be to refinance
1161216	what does maf abbreviation stand for
616330	what date is the bite of seattle
417113	is malathion a restricted use pesticide
816690	what is the difference between a syntax error and a logic error? quizlet
38378	average life span for a skunk
776871	what is nit basketball tournament
1004117	where was the women's rights convention held
742001	what is dysbiosis of the gut
613742	what county is tomah, wi
887406	what plants make a pollinator garden
172292	does the benefit outweigh the cost
737505	what is dasher
971929	where do tulips grow naturally
1028972	who invented the cordless phone
144197	did jesus drink alcohol
785472	what is porcine dermal
824323	what is the hardest piece of music ever written
1061085	why are spices used in foods in india
251296	how long does complete darkness last in alaska
175720	dream about money meaning
677070	what is a charitable gift
966902	where are the t lymphocytes located
601283	what could be the cause of my platelets staying
295458	how many segments are in gps
446731	mcfcu, marquette routing number
430507	is urine organic
575294	what are the types of copd
766151	what is liquid amino acids
879047	what mountain is in colorado
448347	meaning of name Theon
1017066	which part of the heart allows blood to flow in only one direction
257248	how long does it take to get to hall of fame
190516	foods you can eat on mediterranean diet
905921	what times does nyse close
474164	pg pre market stock price
129667	define: opportunistic
298469	how many times has microsoft stock split
38216	average length of adult male bengal tiger claws
390757	ice age beginning and ending dates
603582	what county is broomall, pa
738214	what is degenerative scaphotrapezium joint
389266	hula define
551827	what age should you castrate a dog
934545	whats peva matetial
1065426	why do people wear wedding rings on left hand
313220	how much does blueprints cost
848802	what is the strongest material
213607	how did hoover propose to deal with the great depression?
319789	how much for a wooden staircase
782637	what is pepto bismol good for
452108	medications that cause respiratory depression
727703	what is carbohydrates in food
319791	how much for all your wisdom teeth removed
229393	how expensive are plantation shutters
609189	what county is massanutten va in
957483	when was drew brees born
253432	how long does it take for an egg to get to room temperature
266775	how long should i cook a steak on each side
545733	weather in roatan honduras
476665	polyhydramnios birth defects
123599	define magnetohydrodynamic drive
652526	what does the prostate gland look like
417960	is methane the same as natural gas?
573559	what are the signs and symptoms of hemiplegia
250083	how long does a salon manicure last
631805	what does an electric current produces
676978	what is a chain of custody mag
