462524	nationality of the surname spire
1177442	how much does an account clerk make at kinder morgan
52499	bewilderingly definition
886710	what phase of cellular respiration is glucose a substrate
279226	how many chemicals are in the human body
937125	when did akbar rule india
42075	average salary for a walmart manager
764013	what is labor day celebrated for
717182	what is an reflexive pronoun
474874	phone number to central sunbelt federal credit union on westover drive in hattiesburg mississippi
570486	what are the hip abductors and their innervation
452665	mental definition
193497	gastric bypass surgery cost
1139428	which statement is a correct description of the hoover moratorium?
604403	what county is cleves ohio in
1180602	how long do snap on dentures last
759660	what is integrative medicine definition
918947	what was one effect of the second great awakening on american social values?
159936	do wind deflector quiet wind noise
35500	average cost to replace shingles
792104	what is roblox tix
279543	how many chromosomes does a mature egg have?
959908	when was someday  released
442068	long term effects of exercise on muscular endurance
212161	how cost a piercing
457661	most expensive deck of playing cards
815874	what is the dental formula for opossum
688378	what is a lai?
968987	where did martin luther king jr grow up
847769	what is the speed of a jet at take off
933697	what's the weather in toulouse
499063	skin rash causes and symptoms
560630	what are italian horns
556720	what are cocci
1145847	what the benefits of increasing social security
360689	how to get a dog to stop chewing rattan furniture
199524	hdfcsec hdfc securities
717938	what is angina pectoris signs and symptoms
405988	is chattanooga on eastern time
962915	when was video game contra released
800241	what is strawberry spinach
616578	what day does autumn begin
260378	how long does welding certification take
277886	how many calories is a snack size almond joy
393000	import tariff example
195295	globalization of markets definition
858697	what is udemy?
598115	what color is onyx granite
764952	what is lean w
564156	what are remote locations
447958	meaning of holding hands in different ways
159458	do they usually put the top or bottom braces on first
967580	where can i buy sugar glider
935711	when are neap tides formed
746851	what is fenestrated tear of a tendon
186381	fennel tea how often to drink
252200	how long does it for a broken ankle to heal
93418	clinical symptoms of a molar preg
679916	what is a crp contract
650680	what does the law say about cctv warning signs
284292	how many garlic cloves per tablespoon
941288	when did the chicken dance come out
927817	what year was harley davidson
415416	is kcl an acid
33765	average cost of home construction per sf
461999	name the oklahoma us senators
126926	define semantics.
461470	name meaning of gatsby
402147	is alzheimer's disease a mental disorder
856688	what is torment
809210	what is the biological perspective of psychology
197267	grossular definition
997694	where is the sodor search and rescue center
867916	what kind of energy does a microwave produce
471138	pacific ring of fire definition
1032355	who is dr. albert volk
1002852	where was lord of the rings filmed in nz
657799	what equals a pint
213551	how did harry houdini die
620777	what dinosaur had the most teeth?
472716	pedal definition
4616	Intel average salary
1174578	journey meaning
996467	where is the loin region of the body
645100	what does palindrome mean
662369	what format do you use for a college paper
752143	what is google fibers speed
747565	what is fiscal intermediary (FI)
761765	what is iv cardizem used for
806936	what is the average salary for a walmart employee?
122466	define hyperbilirubinemia in the urine
700211	what is a skeleton shift
235438	how hot does a match burn
24813	are scissor jacks dangerous
8660	_____ discovered significant differences between organisms originally categorized under the monera kingdom; thus, these organisms were placed into two separate domains
669365	what hormone is affected whenever a female under sleeps
464297	nhl goal size history
1025361	who coined the term thagomizer?sssssssssssss
293831	how many power does iphone consume
93988	coca cola Bethlehem phone number
206817	how a cpa can do real estate
704739	what is a undergraduate degree
285952	how many hours does an adult sleep
329914	how much vitamin c is in grape juice
452471	melissa etheridge net worth
180890	enugu population
366581	how to lay out for stairs
252595	how long does it take caffeine to work
982939	where is franklin square located in philly
467780	occasional meaning in english
536267	venus of willendorf is named
848350	what is the state bird and flower of texas
474629	phone number for honda
425863	is the branch of philosophy that deals with issues of right and wrong in human affairs
609116	what county is marlboro new mexico
651112	what does the name audrianna' mean
326438	how much protein do you need to maintain muscle
306146	how much do labs weigh
767054	what is lowrance
579858	what branch of mathematics did descartes found?
70082	can i use rit dye without washing machine
825360	what is the humans rights act
269344	how long to cook a stuffed 16lb turkey
231500	how far is lansing to livonia
1141646	where do strawberries originate
64498	can anyone contest a trust
701829	what is a stroopwafel wiki
986572	where is liberty tennessee
33913	average cost of kitchen remodel with wall removal
983544	where is goodman mo
979604	where is cedar point in ohio located
599588	what company makes vue smart glasses
135018	definition of gravity physics
305486	how much do electricians apprentices make
558576	what are eye experts called
766420	what is liver fibrosis
630828	what does aa stand for associates
719317	what is aprn stand for
1032324	who is dr halsey
821188	what is the fee for an overdrawn account called?
27804	at how many weeks can you feel fetal movement
563170	what are personal skills of a registered nurse
523172	town of ipswich population
906626	what to do in Karbib
401960	is aliante a station casino
726195	what is btu rating
127963	define tempted
543023	weather forecast in avila beach
519712	there is no limit for donation for the food drive
334556	how old is cameron wake
851989	what is the tunnel called between England and belgium called
644160	what does neurofibrillary tangles mean
581533	what can cause tooth pain
555087	what are are the three pigments primarily responsible for photosynthesis
775649	what is ndc number
801426	what is swarovski elements
699778	what is a shmoo
560976	what are learning objectives
1184638	difference between dinosaurs and reptiles
541459	washington's state bird
588742	what causes horner's syndrome
61190	calories large florida avocado
960965	when was the first fraternity founded
1143309	define plasia
1167531	weather in sterling, ks
685392	what is a good pulse rate for a woman
1073660	why oslo is main cty in norway
780459	what is osteocytes osteoblasts osteoclasts
285603	how many hours a day do chihuahuas sleep
1053093	who voices phone guy
534280	usa postal stamp cost
307010	how much do psychologists in the military make
380280	how to sit when taking blood pressure
1174250	laurence fishburne net worth
1062475	why did general lee go on the offensive against the north
277908	how many calories is in a dunkin donut
336200	how old is pewdiepie
234164	how fast is a rat
689795	what is a mah battery?
993374	where is springfield in the simpsons
504470	stroopwafel what is it
1016366	which one is the sign for september
1147004	what note is blue tansy essential oil
714685	what is an fsb
772125	what is micturition
1158624	what is a coronectomy procedure
833696	what is the most expensive supercar
630515	what does a teardrop tattoo by the eye mean
873091	what lean manufacturing is not
615495	what cres fastener material
266346	how long should a hot tub GFI breaker last
321310	how much is a small kitchen renovation
721577	what is avm in computers
947186	when does nfl preseason football season start
196990	green juice ingredients
491311	salary advice cyprus
678907	what is a connective
935309	when and by whom was radar discovered
476998	population du mandoul
1162585	what does a franchisor provide
22183	are earthworms protostomes
523784	transform plate boundary definition
723575	what is beta
563731	what are program electives
39084	average monthly salary south africa
42933	average salary major gift officer
811404	what is the closest city to sakurajima
104746	cost of inguinal hernia operatopm uk
610510	what county is norwalk iowa
828922	what is the longest winning streak in nhl
670923	what influences consumer behavior
404444	is blepharitis is commonly known as a sty
929689	what's a leased vehicle
1016588	which organelle is responsible for intracellular digestion
1172547	number one reason for divorce
358226	how to find a products barcode number
778335	what is null hypothesis
771342	what is metamorphism
480860	price of oil today in oman
451308	medical schools average mcat
127685	define succeed
877087	what mechanism makes you sneeze
62685	can a medical problem with the brain cause anxiety
677303	what is a chimp
423252	is schizophrenia a disease of mind or inherited
1150440	what is the male hormone produced in the testicles?
1035926	who is max from poker night at the invo
858829	what is ultracet generic
673381	what is a LESA
638026	what does gadflies mean
1044562	who manufactures generic adderall
116008	deadline to apply for medicare
237336	how is sex of the baby determined during pregnancy if parents want to know
1807	A meta-analysis is used when
130056	definition - object
1029948	who is amy boucher pye
870230	what kind of qualities does a epic hero have
622643	what do contractions feel like
887660	what policy resulted with the telegram
939622	when did mao zedong rule
357724	how to fast charge a gopro karma grip
156150	do employer rrsp contributions count as income
632557	what does astringent mean
1160291	what does the meaning of maroon color
380456	how to soften toenails naturally
442885	longest yard movie
160306	do you have to attach federal to ca return
778500	what is nypsl
632140	what does anatomic pathology mean is used in an autopsy
958576	when was let me take you  home kathleen written
541903	watermelon days to harvest
556009	what are campaign themes
74340	can termidor be used for ants
679090	what is a contingent fee?
984808	where is hutchins tx located
613198	what county is stanley va in
965372	where are ford mustangs built
192751	functions of the blood
437457	largest tomato plant
1159316	what genre of music is the migos
110353	cost to pour colored concrete patio
36604	average funeral cost in nj
286878	how many kcal's in a bottle of red wine
573859	what are the stages of the  rock cycle
627678	what does 91 db sound like
770082	what is meant by the term logical volume
865985	what kills fleas in human hair
905038	what time is it in union city california
553574	what anesthesia is involved with a nerve block
70396	can interval training be used in swimming as well as jogging?
678110	what is a collateral purpose
397682	invacare phone number
776199	what is net primary productivity npp
966054	where are political cartoons found
274362	how many acres is the king ranch in texas
455997	mood stabilizers and side effects
1081216	ye of little faith meaning
1033831	who is isaac ryan brown
1155435	what is elton john 's middle name
269043	how long to cook a 14 lb stuffed turkey
163127	does an endoscopy require anesthesia
304712	how much do architects charge commercial
499512	smell and taste are produced by which hemisphere of the brain
661146	what foods can help arthritis pain
525528	turf accountant definition
613971	what county is university park il
418492	is morag a scottish name
465661	normal resp rate for 6 month old
1182274	holistic learning what is
830380	what is the maximum loan amount for a first year dependent student
742686	what is edex?
813052	what is the cost to make your own web page
739581	what is difference medicaid and medicare
208567	how big does a dogwood tree get
711298	what is an aggregate pier
555275	what are baby back ribs made from
1147850	darn tootin meaning
314135	how much does human resources worker make
555882	what are buddhist shrines used for
676691	what is a cbz
716909	what is an oscar
100505	cost cubic yard of concrete
152685	disinterested person definition
847396	what is the solid form of water
940367	when did pop music originate?
1170680	side effects of l-arginine
517223	the meaning of the name dane
42116	average salary for an emt in missouri
962651	when was the word googol coined
959880	when was smyth county virginia formed
42536	average salary for physician assistant
1164021	what county is corpus christi texas in?
244842	how long do dogs sleep for a day
90095	ceteris paribus definition econ
933981	what's the world record for the highest vertical leap
887550	what poet says, if thou must love me, let it be for nought/except for love's sake only....
12325	afferent define
412522	is hpv genital warts
1049347	who run the cia established
689374	what is a locus geometry
887416	what plants use rhizome vegetative reproduction
16437	amended returns how many years
371112	how to multiply exponents on texas instruments ti-83 plus
374710	how to read a account number on a check
84001	cattle embryo transfer cost
666957	what happens when a life tenant sells property
266852	how long should i keep bills before shredding
831650	what is the meaning of the name esme
1183710	epipen symptoms
493789	scion etymology definition
613481	what county is tarpon springs florida
815052	what is the definition of health care
643237	what does men's haircut cost at upstairs hair salon?
388793	how's the weather in seoul
483479	pruritus symptoms
909481	what turns mouth black
790207	what is refined sunflower oil
249394	how long does a fire extinguisher last
972138	where do you find skype requests
842026	what is the purpose of a personnel committee
525099	trust fund definition
199039	has school in georgia started
592045	what causes stiffness in hands
30974	average annual increase in health care costs
169152	does milk aggravate diarrhea
829823	what is the manpower group
764915	what is lean manufacturing for fasteners
427116	is the planet venus luminous
192832	fungi definition animal
195664	goldendoodle cost to buy
399567	is a cell or molecule larger
781233	what is panna cotta made of
622956	what do executive mean
1053389	who was benjamin lundy?
587035	what causes death in cyanide poisoning
253219	how long does it take for a rotator cuff injury to heal
676002	what is a bypass capacitor used for
960562	when was the date that 6th amendment proposed
718177	what is another name for a sorbus
828946	what is the longest-running scripted primetime tv show of all-time
460649	muscular system definition
977813	where is bayside texas
1175126	is a port placement a surgery
437737	laser lipolysis benefits
821530	what is the first step in cleaning a firearm?
673725	what is a angina pectoris
279159	how many championships have the spurs won
248540	how long do you need to keep tax forms for old employees
318306	how much does street sweepers get paid
191054	formula for finding dew point temperature
588968	what causes internal muscle spasms
457056	most common stainless steel grades
685525	what is a good temperature for a freezer
878646	what month are raspberries in season
744852	what is esophagus. b
733309	what is considered a full time student load
656665	what effect does the growth hormone have on metabolism
713725	what is an enthymeme
706466	what is a wordsmith
89995	certificate of loss of us nationality
839490	what is the plural of lens
315293	how much does it cost to file for bankruptcy
468524	on a harley if you use a turn signal canceller modual do you still need a flasher?
946683	when does hydrocodone peak in urine
544194	weather in federal way wa
865103	what is zynga
429296	is there such a day as colorado day
812637	what is the cost of a new bathroom
880148	what music legend just died
841822	what is the pupil of your eye
1000644	where is your liver located diagram
934156	what's wool carpet average cost per square yard
407183	is cork in northern ireland or southern ireland
278548	how many carbs in a slice of buttermilk bread
811421	what is the closest international airport to southampton england
708879	what is agile development environment
255486	how long does it take to become a bailiff
752085	what is google apps for android
472156	patent ambiguity definition
514330	the average methodist pastor salary
175339	downy meaning
833413	what is the most common baby name
698979	what is a scalable vector graphic
530818	typical cost of skin resurfacing
132968	definition of bruits
341593	how tall is trevor noah
926050	what year did cigarettes come out
254526	how long does it take for soma to clear
141791	describe the function of the tricuspid valve in the space below
841676	what is the property of starches
944940	when do umbilical cord fall off?
1029854	who is alicia keys brother
646736	what does reac inspection mean
38699	average male says how many words a day
799896	what is stereotactic radiotherapy
200921	help for ibs diarrhea
990050	where is palm harbor florida near
914114	what type of product treat ticks
894006	what should the climber do if the z-clip
61245	calories of pho medium bowl
175779	dreaming is most likely to occur during which stage(s) of sleep?
301147	how many years of college to be a teacher
296198	how many sports team in new york
94541	collating definition
968955	where did madame c j walker grow up
572906	what are the readings for blood pressure
864813	what is zero escape
1025670	who created nanotechnology
777787	what is normal temperature for baby
700182	what is a sith assassin
119408	define coniferous forest
1183165	forestry definition
138897	definition of thermal   energy
832257	what is the medical symbol for magnesium
613859	what county is tukwila
242736	how long can urine sample sit out
1183414	fibromyalgia symptoms, does it affect the joints?
535128	utility king pigeons
399628	is a co signer needed to sign federal perkins loan
302915	how much calcium in a glass of almond milk
523936	translation and what language is uber?
938973	when did humans enter the stone age
19234	answer for how does the temperature of earth's crust compared to the temperature of earth's interior
1053960	who was female star of flashdance
824178	what is the gu system
914056	what type of poppy is illegal to grow
699433	what is a senior capstone
722901	what is bed mobility
986235	where is lake wawasee
57361	bushel crabs obx price
732384	what is comet cleaner made out of
784060	what is piperacillin-tazobactam
585005	what causes a swollen uvula?
911208	what type of compound is often found in flowers and fruit flavorings
561467	what are manufactured fibre
728285	what is catch weight in boxing
1019216	which side of coil to pick up tacho signal
660584	what food is high in vitamin b17
799356	what is stalingrad
231709	how far is miami airport from cruise port
137129	definition of pink slip
828589	what is the literal translation of the term jihad?
43798	average score of the lsat
439054	legalization of marijuana effects
1172662	nordstrom rack stock price
756913	what is iberia
754494	what is hemitite
641228	what does it mean when toes are numb
412534	is hsa taxable
828918	what is the longest wavelength on the electromagnetic spectrum
72758	can property tax be added to a house that is being leased
442440	longest lasting hurricanes
799131	what is squids seed
648623	what does stomach ulcers feel like
806012	what is the average cost of fixing and front declawing of a cat
408063	is depression an emotional disorder
612598	what county is sergeant bluffs ia in
236264	how is atomic mass determined
859642	what is us letter paper size
214097	how did matthew henson die
822888	what is the function of the nervous system
646565	what does quarterly
147204	difference between entrepreneur and inventor
740217	what is disproportionality idea
813529	what is the currency called in france
988740	where is my liver?
481926	prison did bernie kerwick go to
450213	meaning of the prefix em
628118	what does a ash tr
538856	waiting with bated breath meaning
768306	what is mangroves
92508	circadian rhythm clock definition
73803	can spurs on the hips be cured by physical therapy or do you need surgery
1027907	who founded mac cosmetics
105439	cost of mar
986581	where is libya and located
1014160	which nutrient is in spinach
509969	synonyms of large
114465	curve means what?
484421	qualifications to be an actor
946326	when does digestion begin?
1058676	who wrote short ride in a fast machine
669441	what hormone stimulates release of fsh and lh from the anterior pituitary
1022664	which virus causes mumps
1036851	who is paprika?
406971	is compost good for peas
515579	the difference between sensory and consumer research
698969	what is a sbm
208531	how big do sugar gliders get
685387	what is a good protein skimmer
293440	how many playoff games are there?
964990	where are backpacks made
1184755	des moines and surrounding population
169835	does oolong tea have much caffeine?
546865	web browser mode excel hidden columns
1077484	will gardening help me lose weight
673748	what is a another word for helium
529781	types of sirloin
390123	hyundai of baton rouge la
740159	what is disk defragmenter
1031046	who is captain ahab
415701	is known to get two cartilage piercings at once
899756	what super bowls did tom brady lose
432779	japan is in what region in the world
56409	bristol meaning of name
35975	average dentist salary us
1042654	who is van meurs?
268011	how long to bake a potato in a crockpot
796445	what is single pair health care
584541	what causes a fast pulse?
146940	difference between cte and temp table
572609	what are the principle of good documentation practice
789000	what is quetiapine used for
1142283	when was princess vicky born
267339	how long should yogurt incubate
714368	what is an example of reverse polarity
293623	how many positions are there in soccer
530072	types of tables in excel
76700	can you deduct car maintenance and mileage
268568	how long to boil chicken drumsticks
420920	is photosynthesis anaerobic
1034418	who is john dalton
243715	how long cooked eggs in fridge
834006	what is the most unhealthy state in america
392431	ihave moderate osteoarthertis can i get disability
95581	common horse tree
916364	what usually kills patients with cf
22778	are guava good for your health
979045	where is byfield ma
13259	age limit for volunteers
352275	how to cook boudin boiled
760656	what is iran's currency called
973877	where does sit tight come from
66048	can copd cause rib pain
73359	can sheet vinyl be laid without glue
392061	if you boil salt water does salt remain
193534	gastroscopy cost
329165	how much to install carpeting
247775	how long do you cook turkey drumsticks
614601	what county is white sulphur springs in?
278736	how many carbs is allowed on the keto diet?
754828	what is hexane
140620	delivery of healthcare over the internet is known as what
147775	difference between lice and dandruff
20778	are all private sponsors named sponsors
122339	define honesty in the workplace
87649	causes of nondisjunction
79614	can you set up forwarding on aol email?
920112	what was the eisenhower doctrine? answers
1001136	where the lymph nodes circulation return
911330	what type of crime is obstruction of an officer
492804	san francisco average temperature
909128	what travel service has detailed flight finder with open destination
323836	how much l-methionine can you take a day?
474016	pertussis contagious period
575836	what are three kinds of carbon chains found in hydrocarbons
1058985	who wrote the learning tree
38217	average length of an lsd trip
1151596	what is the cost of college education in computer science
977024	where is apple day celebrated
396955	interagency committee defined
1072312	why is the black sea called black
778838	what is octal
793794	what is satin pothos
1179067	how many dry figs are in a pound
656488	what education is needed to work with animals
741799	what is durable power of attorney form
172960	does the staffordshire bull terrier  drool
186059	federalism definition in american politics
647651	what does seed mean
1007030	which clade is most primitive
599277	what command to check which domain you logon to
280111	how many creatures have humans found
577228	what are zip codes for katy area
181470	esmae name meaning
686668	what is a hematuria?
338178	how quality is defined in meshing
580042	what breathing sound can be heard anywhere in the chest
632364	what does arbitration agreement means
1039929	who is the designer for lacoste
971440	where do princess mary and frederick live
203179	highest winrate camp in league
718399	what is another term for secondary consumer?
436125	largest chevy truck dealer
303262	how much can i load on my walmart money card at once
646445	what does pulmonary surfactant do
645873	what does pompadour mean
638183	what does geologist means
313823	how much does fdic insure per account
1180530	how long does a beats pill take to charge
66713	can domestic violence records be expunged
592850	what causes thrush tongue in adults
454	1 cubic foot of natural gas is how many btu
325639	how much ntuc membership fee
1052750	who stays together married at first sight
401579	is administrative leave considered for the benefit of the employer?
548834	what  does case status review in small claims court mean
839	2 foods rich in vitamin c
1010831	which income is higher gross or net income
716623	what is an oops concept
1180607	how long do periods last female
900508	what team did kevin durant play for
88899	causes of upper left chest pain
13137	age in tn can a child be home alone
277315	how many calories in burger king croutons
509315	syndicate definition commercial loan
590159	what causes nauseous feeling
914524	what type of service is dental braces considered
