121352	define extreme
634306	what does chattel mean on credit history
920825	what was the great leap forward brainly
510633	tattoo fixers how much does it cost
737889	what is decentralization process.
674172	what is a bank transit number
303205	how much can i contribute to nondeductible ira
570009	what are the four major groups of elements
492875	sanitizer temperature
54528	blood clots in urine after menopause
738368	what is delta in2ition
507001	symptoms of an enlarged heart in dogs
466926	number of times congress voted to repeal aca
1181095	how is a behavioral crisis defined?
224811	how does a firefly light up
918533	what was introduced to the human diet in what year
80926	can you use wallapop on your computer
906071	what to add to your water to be healthier
428191	is there a generic for ciprodex ear drops
790457	what is reinforced mesh
242081	how long can i freeze pork
1006418	which cal state schools have football teams
843270	what is the rarest form of iron
551231	what age does pediatrics go up to
166621	does gasoline come from natural gas
490462	routing number hdfc
316859	how much does it cost to screen in a window
45248	average temperature in london in august in celsius
1176220	average temperatures barcelona israel
867974	what kind of enzymes produces the streptomyces janthinus?
529604	types of roof lines
439538	lewisville texas is in what county
436798	largest laser cutter in the world
1074527	why use cypress mulch
167374	does hypokalemia cause dysrhythmias
389298	human body flexion definition
640699	what does it mean to get a headache when you eat sugar
132366	definition of anthropophobia
932727	what's the population of baltimore maryland
466858	number of seats in rice eccles stadium
1079617	work study average pay
381728	how to straighten a tree that is growing slanted?
672091	what is .arf file
895696	what size pump do i need for a 24 above ground pool
4801	Keena name meaning
122479	define hypersonic
1180498	how long does a letter airmail take
797201	what is smog caused by ?
293603	how many pools on norwegian epic
547843	weight watchers tech support number
1057322	who were the actresses in cheers?
1168693	us anesthesia partners nevada
641469	what does it mean when your fingernails peel
693178	what is a nuclear fuel pellet
23229	are ketones ever used for energy
874646	what main the function of vacuole
924673	what will happen if I connect a 110v motor to a 220v supply
207697	how are polymers made
445243	maranda name meaning
291569	how many pairs of chromosomes in a human cell
493513	schmidt natural corporate address
506152	symbolism of the bear in native american culture
322801	how much is perez hilton worth
953121	when is the new season of street outlaws
881296	what nba rank is westbrook in
1142466	when to start timeouts with toddlers
20627	ardent love definition
1146849	what parts of the body does valley fever affect?
2341	CLAREMO POST CODE
49519	becoming a certified tax consultant
653387	what does the washington monument commemorate
147502	difference between half-life and source
511965	temperature in april for dublin ireland
1038183	who is scheherazade
907017	what to do with orchid after blossoms fall?
932677	what's the peloton
502890	starting salary of chiropractor
921906	what was the ottoman empire before it existed
381849	how to study for exam on the bones
788322	what is pultrusion
511517	temp for cooking pork loin
894688	what sign does gemini get along with
335391	how old is john peter lozinak jr
445408	marijuana for weight loss
350407	how to clean a ring around the toilet bowl
770661	what is medieval times
499241	slap tear in shoulder definition
893501	what shoes do most nba players wear
736625	what is cultured stone
1021478	which trimester do we find out sex of child
565638	what are some of the compounds that are salts
873032	what leader created the people's republic of china
728481	what is causing my bruising
630324	what does a snapping turtle look like
573815	what are the stages of a cold sore
685014	what is a gondola
895823	what size syringe for insulin
185244	fastest animal running in the world
936625	when can you change to a booster seat
997228	where is the port orleans resort compared to port orleans french quarter resort at disney
277407	how many calories in cucumber salad with vinegar
148099	difference between nucleophile and electrophile
664304	what gpa is needed to get into cortland
1182320	hither definition
123192	define larynx
435183	labor cost to install tile shower
86112	causes of dry sockets
261590	how long fry pork chop
22774	are gsa schedule rates fair and reasonable
34189	average cost of overnight stay in hospital
582382	what can syphilis cause
953091	when is the new apple ipad available
20660	are Lumbee indians aboriginals
297928	how many teeth does the average person lose
625752	what do u understand by SI units
1051009	who sings fly me to the moon in the commercial
29939	autism spectrum disorder definition
769753	what is meant by crib death?
24876	are shareholder loan repayments taxable
809567	what is the box ticking
213262	how did dr. myles munroe die
808481	what is the best protein powder for smoothies
651465	what does the name hesper mean
6621	Vessels that carry blood away from the heart are
709444	what is algebraic geometry
565362	what are some example of quasi experiment
822547	what is the function of male reproductive system
130707	definition extradition
1180992	how is property divided in a common law situation
576432	what are two types of continental margins?
301575	how marijuana is used?
729957	what is chicken afritada
222947	how do you loop a song on spotify
880877	what nationality is surname gan
779384	what is one example of showing someone humility
332534	how often should you really change your oil on a chrysler van
207065	how alkalize your body
57187	burger king serves lunch hours
755748	what is hotel transylvania rated
940558	when did rogue one open
1177874	how much a sourcing specialist/buyer makes?
204451	home remedies cleaning
1059094	who wrote the protestant ethic and the spirit of capitalism?
186192	feistiness definition
421028	is pippa middleton older than kate
69522	can i request prior years tax returns from the irs
981623	where is dr. pol located
532671	university of phoenix american psychology association accreditation
1183306	appraisal meaning in hindi
158239	do parents go to their kids college orientation
61334	calories snack pudding
53141	biggest holder of us debt
636979	what does epidemiologists do
848927	what is the structure of germany government
1007813	which county is black station, ca
1068539	why doesnt my blackberry connect with pc
1144750	what vitamins if your hair is falling out
198365	handwriting ocr for windows
341485	how tall is the oroville dam in feet
36435	average fee to put an animal to sleep?
39302	average nascar lap
250749	how long does an mri last
200879	hellcat dodge challenger retail price
1137404	who was lillie johnson
402329	is amortization an asset or liability
614217	what county is waldwick in
1166967	what are ajanta caves
655747	what dose of bactrim for uti adult
149789	different hemoglobin levels
398412	iron maiden janick
483395	provogue aviator price
664964	what happened during the missouri compromise
717192	what is an rf modulator used for
133663	definition of courtly love
1156654	what is another name for niacin deficiency
564661	what are semitic peoples
795480	what is sg&a
225058	how does a provost relate to leadership
611897	what county is richland mi
64798	can bananas make you sick
571903	what are the names of preventer inhalers
1149718	what is the population of austin?
413197	is iodine in spinach
243209	how long can you keep open tomato sauce
1028637	who invented cha cha cha
605573	what county is elk river, mn
122753	define inheritance biology
874746	what major role did galileo play in the scientific revolution
1139457	which spacecraft deployed the chandra x-ray observatory
302318	how much are roosevelt dimes worth
950281	when is fathers day
632287	what does api stand for in software
387286	how violence has affected teenagers
639414	what does imagery do in a play
636366	what does dry hump mean
467969	oe manufacturer definition
644027	what does nasdaq track
826686	what is the kawasaki disease genetic
723484	what is best for blocked bathroom sink
686417	what is a hcv test
701343	what is a star smog check
91415	cherokee iowa is what county
410227	is fish mox safe for cats
306757	how much do people usually pay for pelvic exam and pap smear
299715	how many weeks are there in a pregnancy
205385	hormones are chemicals that are secreted and go directly into
305636	how much do fingerprint readers typically cost?
203070	highest temp in prescott az
319885	how much for ira contribution
1153652	what is nitroglycerin treat
699113	what is a scientist called who studies insects
1169480	the pigment chlorophyll is used in this process
301370	how many years to become a pediatrician
500419	sommelier definition
593680	what causes yellow diarrhea in adults
477684	population of greenville county, sc
205250	hop tropic
510223	tabloid page size
669921	what hybrid parking
978970	where is burbank illinois?
651528	what does the name jasmin mean
944554	when do robin eggs hatch
1171161	requirements prior to deploying wsus
612267	what county is sales city, ga?
40105	average pay of ups package car driver starting
9024	____________ is the temporary withdrawal of a person's license or driving privileges
960593	when was the desktop computer invented
1155108	what is footnotes apa
398840	irs publication hsa qualified expenses
1149663	what is the primary advantage of operating interdependent subsidiaries
50919	benefits of juice cleansing
929341	what zone is covent garden
1166393	what are reduced fare metrocards
898519	what states is medical marijuana legal in
576982	what are werewolf mates
749265	what is fructose corn syrup
467130	number two rolling stone greatest albums
824416	what is the health benefit of turnip greens
1137205	definition of photoelectric converters
573572	what are the signs of a broken finger
1181109	a/n _____________ is awarded by a college or university after a prescribed course of study that usually lasts four or more years. *
750006	what is gary keller's net worth
997040	where is the outlook button button?
259058	how long does one day on uranus take
249709	how long does a lion eat
170450	does power of attorney have a say in medical
857083	what is tramadol for
40436	average pressure washing cost
1054311	who was in the limo when jfk was shot
1174504	ketorolac (toradol) side effects
1078434	windsor movie cast
502744	starter remove on a polaris 400 sportsman
379862	how to setup a google email account on outlook 2010
310900	how much does a physician assistant
682692	what is a example of a balance science
254103	how long does it take for lipo surgery
1043711	who make the land rover
48934	base pair definition
968028	where can we buy ebay gift cards
396139	inhibitor definition biology
1150737	what is the highest level of six sigma
1011987	which is the command key on computer
575438	what are the units of gauss
437662	largest woodpecker in the world
68636	can i combine two 15 amp circuits
173800	does visio require office
191277	founders fcu routing number
854557	what is the world record for fastest motorcycle
483716	psychotherapy fees average
138121	definition of sex linked disease
134735	definition of flat
296437	how many square in acre
474484	phone number amazon customer service usa
1041187	who is the oldest elected us president by age
147610	difference between income and salary
333415	how old do you have to be to buy a plan b
298707	how many total languages spoken in india
969792	where did the phrase blue moon originate
120533	define dominance
498274	similarities between developing and developed countries
477080	population hobart
964919	where are american express airport lounges
680868	what is a dental procedure
255792	how long does it take to build muscle?
1164782	what causes fluid in the ears?
176585	duration of delayed cord clamping
562579	what are of the world is turkey
336157	how old is patrick stump
429142	is there going to be a dolphin tale 3
680078	what is a cultural crossroad
872145	what language do they speak in italy
81122	can you write a check to clear the next deposit day?
1005800	which bacteria cause ear infections in dogs
842844	what is the purpose of the neutral wire
279359	how many children does george jones have
532900	unwind define
227408	how does restorative justice process help the victim
1044368	who makes the escalade
129951	defining an array in a struct
766960	what is louvre
477932	population of merrillville indiana
731159	what is cleanliness testing
16151	amara name meaning
255662	how long does it take to become an embryologist
101053	cost for fairfield university
260331	how long does vicodin time release stay in system
757045	what is ice water temperature
871410	what kind of yeast to use for making wine
855294	what is the zip code of brookings south dakota
432561	iwhat is a scallion
910317	what type of archetypal hero is luke skywalker
389707	hybrid poplar lifespan
279791	how many color episodes of tales of wells fargo
751758	what is goldschlager
137806	definition of restitution
12527	after exposure how long to get a virus
641627	what does it means ono
473334	percentage of communication that is nonverbal
1159466	what food will help improve thyroid function
557616	what are desert diamonds
619849	what did the ancient greeks wear
699713	what is a shelf bra camisole
644536	what does oaa services mean
404694	is bppv curable
622955	what do exacerbate mean
720362	what is associate of individualized degree
171566	does southwest fly to orlando melbourne international airport
662001	what foods to eat on candida diet
403561	is august winter
242943	how long can you have a disability check
585437	what causes are theof uti in men std
184945	famous artist who painted clowns
603004	what county is belle plaine ks
990828	where is port judith
1143845	what's another meaning of loyalty
762831	what is kapa haka?
268851	how long to carbon monoxide alarms last
33067	average cost of assisted living in kansas
600594	what content should  alumni bylaws?
965600	where are kia sorento built
377460	how to reshape plastic glasses
837411	what is the old name of egypt
779566	what is online resources
1046685	who played frenchie in the movie grease
23260	are kittens born without fur
593916	what causes your mouth to have a sore and not heal
1022170	which type of sanitation device (msd) is used solely for the storage of
622845	what do drone photographers charge
614585	what county is white bluff tn located in
969068	where did one night stands come from
422005	is pv cancer treatable
1044928	who originally sang future so bright gotta wear shades
408282	is digoxin the same as digitek
1149219	what is the sick role of a patient
258183	how long does it take to show on pregnancy test
591203	what causes redness, rash, swelling in lower legs
457018	most common religion in usa
701353	what is a starseed
604744	what county is covington ?
702649	what is a system hardware
976853	where is ancient babylon today?
767177	what is lubis
318512	how much does the average pair of testicles weigh
1163618	what county is selma al
541806	water treatment operator pay in florida
981772	where is dunnsville va
515779	the economics of wind energy
645202	what does passive education mean
1027557	who endorsed free silver
597353	what color are the smurfs
299519	how many voting representatives are in the house of representatives
427779	is the wolsley a hotel
644893	what does oscar weigh
23949	are nylon sutures considered permanent
929562	what's a cystic pimple
714345	what is an example of paracrine signaling
39431	average number of ears of corn in a bushel
10656	acquisition loan defined
637378	what does fair is foul and foul is fair mean
196525	grandfather definition
305159	how much do cna's get paid in reading pa
612008	what county is robbinsville nc
706264	what is a white tongue
1048952	who produced the movie unbroken
1169661	the definition of culture includes
376293	how to remove rust from battery contacts
1181715	how do lipids function
738672	what is depositional force
937756	when did cephalopods first appear
115802	daylight savings time 2015
879793	what muscles are in the forearm
303306	how much can i withdraw municipal credit union atm
479507	prefix definition of im-
66378	can depression cause insomnia
372806	how to poach an egg using a poachpod
473063	pepsin definition biology
231667	how far is maumee ohio from chicago
466716	number of members of the sanhedrin
252302	how long does it take a cockroach to die?
973838	where does seaweed grow
963378	when were term limits imposed for us pres
290914	how many ounces are in a typical bottle of champagne
683638	what is a flush valve
1046246	who pays the title policy in a real estate transaction
89631	cellular differentiation is responsible for _____.
121755	define function of cytoplasm in bacteria
688450	what is a lard
594812	what channel is young sheldon
478064	population of parker, pa
937069	when did abraham get assassinated
923356	what wavelengths does hemoglobin absorb at
120301	define dignity
439753	lichen sclerosis mouth symptoms
100924	cost for central air installation
575367	what are the types of skin cancer ?
232088	how far is quechee vermont from boston
589776	what causes melena stools
449458	meaning of the mexican hat dance
266396	how long should a pendant light be over an island
788830	what is quadramed
741731	what is duloxetine generic for
525242	ttl meaning electronics
708532	what is advising
902940	what test is more accurate for allergies
839227	what is the photoshop graphic file format
299695	how many weeks are in a average month
1163686	what county is phillips wi
590418	what causes our lights to flicker
326261	how much potassium should one consume in one day
540811	was the battle of cold harbor one of the worst for union
617387	what defines generation x
1161619	what does groggy mean
770678	what is mediterranean
826353	what is the iranian currency called
651525	what does the name jarrett mean
956489	when was a raisin in the sun published
668505	what helps denture pain
977629	where is bane from
725543	what is boxed
1168602	value of r in pv nrt
181836	et al abbreviation meaning
995801	where is the grand canyon in tx
917711	what was a cossack?
65739	can claritin raise blood sugar
668182	what have van de graaff generators been used for
201556	heterogeneous mixture  definition
597336	what color are the best for florida homes?
129895	defined contribution plan
300625	how many years did abby lee miller get in jail
628841	what does a dream mean when you can fly
82881	carousel meaning
107646	cost of triaxle load of topsoil
679918	what is a crp lab test
503147	states that don't change to daylight savings
585365	what causes an overjet
87223	causes of lethargy
254393	how long does it take for polyurethane to dry
389999	hypo- prefix definition
276141	how many calories are in pound cake
882608	what occurs during elongation of translation
217080	how do glaciers affect land
59236	calories and fat in a boba tea
571070	what are the long term antihypertensive effects of diuretic
65428	can cats eat fish skin
1028262	who has the fastest fastball in baseball
735559	what is cplp certification
516360	the hematocrit is composed of
1161517	what does incipit mean
728987	what is cellular respiration kind
693391	what is a orthotics
417406	is marmite a source of protein
819787	what is the eating disorder called?
590794	what causes phlebitis
103514	cost of data entry errors
448597	meaning of name lysander
229770	how far away is the voyager
690624	what is a membrane in biology
448639	meaning of name nikko
582304	what can put you into kidney failure
40039	average pay in san antonio
699391	what is a self storage
244014	how long do I cook a 4 lb beef roast on a rotisserie
843649	what is the recovery period of acl surgery
333910	how old do you need to be to have a youtube account
1181972	how big is sudan population
729525	what is chamois material
963800	when will interest rates rise
409668	is eucalyptus endangered
333359	how old do you have to be to be a cna
632214	what does antares mean
686919	what is a hoedad
806737	what is the average price for a used golf cart?
799768	what is steam extruded feed for horse
872660	what language people speak in belgium
1165662	what are the side effects of januvia?
645515	what does phenol do in dna extraction
242956	how long can you have thawed chicken in refrigerator before you must use
794757	what is sed in linux
1045087	who owns android platform
769495	what is mean by non decreasing order
1009273	which evangelist became an atheist after holding many meetings? his name was chuck ....
795505	what is sgi
1043402	who made personality traits
744545	what is equilibrium in chemical reactions
724583	what is bladder infection
25327	are the ashes already put in a memorial necklace
752009	what is good salary for accountant and office manager
466899	number of students at virginia tech
709226	what is alaska native
647800	what does sgot mean
785179	what is polyester fabric made out of
126225	define rational numbers
535189	uveitis signs and symptoms
1138833	who is alphabet stock
870634	what kind of soil do avocados need
735174	what is cost analysis?
933151	what's the temperature in fairbanks
619051	what did glenn quinn die from
814265	what is the date when colombia gained its independence
67129	can estate administration expenses be deducted from trust return
501518	spiritual meaning of a spider
518221	the photography show ted forbes
514834	the concept of the looking-glass self suggests that we __________.
895558	what size lead would a wooden pencil have?
563162	what are personal computers
558436	what are examples of eukaryotes
596923	what coffee bean does folgers use
944058	when do i have to pay overtime in virginia
748726	what is fort benning, georgia's area code
1145846	define conducted
571361	what are the major earthquake zones in the us
607769	what county is jeffersonton va in
163724	does being a dentist require a license
671139	what ingredients are in digestive biscuit
1137596	who starred in alice in wonderland
154202	divalproex medication side effects
58157	cahaba medicare provider customer service number
1166924	what are bacteria using as nutrients in the bhi agar
527715	types of fish caught around amelia island
946030	when does big bang theory air
560295	what are in cloth diapers
1146964	what orbitals overlap to for oh sigma bond
1047467	who played tuvok in star trek voyager
668875	what helps with shedding for dogs
623735	what do komodo dragons eat
675063	what is a bluetooth transmitter
580815	what can be done for poor circulation
693836	what is a passato
295949	how many sodium grams per day for hypertension
387832	how was the pencil evolved
797897	what is solenis
996163	where is the intrathecal catheter inserted for a medtronic pain pump
574668	what are the three main layers that make up the healthy part of the skin
770789	what is megestrol used for
484672	quinine tonic water side effects
667304	what happens when one spouse dies ssi
198740	hartland wi is in what county
486620	reflex nerve definition
6488	Transcendentalism is the name for
876664	what mbps speed do i need for netflix
195794	good gelatin is
616551	what day did world war one start
117078	define a tissue
1168573	vector control in orange county
753801	what is hasp driver
912071	what type of eruption does stromboli volcano have
914041	what type of political system does greece
206073	hotels in oak grove ky
1031239	who is charles bovey
888923	what product uses the most sugar
791523	what is rgb colour space
731866	what is codeine in
544252	weather in folsom la
569608	what are the estate tax rates in illinois
989727	where is olive hill ky located
583656	what cause a partially empty sella
956211	when to use paired sample t-test
43041	average salary of a corrections officer
265636	how long it takes for black mold
329617	how much to surgical residents make a year
274905	how many articles are in the ucmj all together
982658	where is fisher river creek nation
633086	what does beta lactamase coverage mean
249369	how long does a female dog stay in heat ?
122470	define hypergamy
438534	learning how to play basketball
572602	what are the principal advantages of bureaucracy?
1165967	what are the four body fluids
810862	what is the chemical name for atropa belladonna
80472	can you use acrylic paint for nail stamping
571304	what are the major american symbols that define american culture
795979	what is shuttering plywood
849678	what is the tailbone muscle called
1072666	why is the shape of the protein important
150716	different types of noise protection for ears
418213	is milkweed perennial
1034348	who is joan walsh
124312	define multivariate analysis statistics
1152951	what is review
788237	what is pug
416456	is lincoln memorial open at night
1049770	who sang dirty diana
476632	poltergeist movie girl that died
540996	was the purpose of the agricultural adjustment act?
927516	what year the first cellular
1065299	why do owls hoot
639322	what does ice stand for, immigration
401025	is a staph infection a sign of something more serious in dogs
860741	what is verizon communications
1066184	why do you have an emg nerve test
680748	what is a delayed recall?
833328	what is the mortgage protection center
593632	what causes window air conditioner to leak water
983298	where is george mason regional library
271411	how long to keep smoked turkey deli meat
680980	what is a design study
955691	when to prune crape myrtle
685504	what is a good substitute for gelatin
765158	what is legal status of a cooperative
891184	what requires wind to work
566359	what are striped sunflower seeds called
684250	what is a fut
138038	definition of secant
723911	what is bilberry tea good for
165770	does dura lube really work
930033	what's an indicator?
752985	what is gsm unlocked phones
